{
  "$schema": "http://json-schema.org/draft-07/schema#",
  "$id": "https://example.org/schemas/envelope.schema.json",
  "title": "CI/CD Event Bus Envelope",
  "type": "object",
  "additionalProperties": false,
  "required": [
    "correlationId",
    "messageId",
    "eventType",
    "source",
    "schemaVersion",
    "specVersion",
    "timestamp",
    "payload"
  ],
  "properties": {
    "correlationId": {
      "type": "string",
      "minLength": 1,
      "description": "Groups related messages together, allowing for easy tracking and correlation of events across systems. All messages that are part of the same workflow or transaction should share the same correlationId."
    },
    "messageId": {
      "type": "string",
      "format": "uuid",
      "description": "A unique identifier for this specific message instance."
    },
    "eventType": {
      "type": "string",
      "pattern": "^[a-z0-9]+(\\.[a-z0-9-]+){2}$",
      "description": "The type of event in the format of <domain>.<entity>.<action> (e.g., automation.run.failed, monitoring.alert.opened)."
    },
    "source": {
      "type": "string",
      "pattern": "^[a-z0-9]+\\.[a-z0-9-]+$",
      "description": "The source or origin of the event in the format of <domain>.<resource> (e.g., azuredevops.agentpool, github.workflow)."
    },
    "specVersion": {
      "type": "string",
      "const": "1.0",
      "description": "Envelope specification version."
    },
    "schemaVersion": {
      "type": "string",
      "pattern": "^[0-9]+\\.[0-9]+$",
      "description": "Version of the payload schema for this event type."
    },
    "importance": {
      "type": [
        "string",
        "null"
      ],
      "enum": [
        "critical",
        "high",
        "normal",
        "low",
        null
      ],
      "description": "Indicates the importance or severity of the event. This can be used for filtering and prioritization. If not specified, it defaults to 'normal'."
    },
    "timestamp": {
      "type": "string",
      "format": "date-time",
      "description": "RFC 3339 timestamp when the event was detected (e.g., 2026-04-21T13:45:30Z)."
    },
    "payload": {
      "type": "object",
      "description": "Event-specific payload. Validate with event-specific schema based on the 'eventType' field."
    }
  }
}
